{
	"$schema": "https://json-schema.org/draft/2020-12/schema",
	"$id": "https://nuxt.ui.alixan.kz/schema/registry-item.json",
	"title": "Alixan UI Nuxt Registry Item",
	"type": "object",
	"required": ["name", "type", "title", "description", "files"],
	"additionalProperties": false,
	"properties": {
		"$schema": {
			"type": "string"
		},
		"name": {
			"type": "string",
			"pattern": "^[a-z0-9-]+$"
		},
		"type": {
			"type": "string",
			"enum": ["component", "block", "utility"]
		},
		"title": {
			"type": "string"
		},
		"description": {
			"type": "string"
		},
		"files": {
			"type": "array",
			"minItems": 1,
			"items": {
				"type": "object",
				"required": ["source", "target"],
				"additionalProperties": false,
				"properties": {
					"source": {
						"type": "string"
					},
					"target": {
						"type": "string"
					}
				}
			}
		}
	}
}
