{
	"$schema": "https://nuxt.ui.alixan.kz/schema/registry-item.json",
	"name": "dialog",
	"type": "component",
	"title": "Dialog",
	"description": "Modal dialog with overlay, teleport, slots and smooth transitions.",
	"files": [
		{
			"source": "templates/dialog/Dialog.vue",
			"target": "components/ui/dialog/Dialog.vue"
		},
		{
			"source": "templates/dialog/DialogHeader.vue",
			"target": "components/ui/dialog-header/DialogHeader.vue"
		},
		{
			"source": "templates/dialog/DialogHost.vue",
			"target": "components/ui/dialog-host/DialogHost.vue"
		},
		{
			"source": "templates/dialog/useDialog.ts",
			"target": "composables/useDialog.ts"
		},
		{
			"source": "templates/utils/cn.ts",
			"target": "utils/cn.ts"
		}
	]
}
