{
	"$schema": "https://nuxt.ui.alixan.kz/schema/registry-item.json",
	"name": "select",
	"type": "component",
	"title": "Select",
	"description": "Floating label select with optional teleported menu and outside click catcher.",
	"files": [
		{
			"source": "templates/select/Select.vue",
			"target": "components/ui/select/Select.vue"
		},
		{
			"source": "templates/utils/cn.ts",
			"target": "utils/cn.ts"
		}
	]
}
